13262838-13262990 sdep: msg_type: "Command" "cmd"
13262990-13263295 sdep: cmd_id: "Command ID: 0x0a00" "cmd_id: 0a00"
13263295-13263447 sdep: payload_len: "Payload Length: 14, More: 0" "len: 14, more: 0"
13263448-13263600 sdep: payload: "A"
13263600-13263752 sdep: payload: "T"
13263752-13263905 sdep: payload: "+"
13263905-13264057 sdep: payload: "G"
13264057-13264209 sdep: payload: "A"
13264209-13264362 sdep: payload: "P"
13264362-13264514 sdep: payload: "G"
13264514-13264666 sdep: payload: "E"
13264667-13264819 sdep: payload: "T"
13264819-13264971 sdep: payload: "C"
13264971-13265124 sdep: payload: "O"
13265124-13265276 sdep: payload: "N"
13265276-13265428 sdep: payload: "N"
13265428-13265581 sdep: payload: "
"
44216107-44216259 sdep: msg_type: "Command" "cmd"
44216259-44216564 sdep: cmd_id: "Command ID: 0x0a00" "cmd_id: 0a00"
44216564-44216716 sdep: payload_len: "Payload Length: 14, More: 0" "len: 14, more: 0"
44216716-44216868 sdep: payload: "A"
44216868-44217021 sdep: payload: "T"
44217021-44217173 sdep: payload: "+"
44217173-44217325 sdep: payload: "G"
44217326-44217478 sdep: payload: "A"
44217478-44217630 sdep: payload: "P"
44217630-44217783 sdep: payload: "G"
44217783-44217935 sdep: payload: "E"
44217935-44218087 sdep: payload: "T"
44218087-44218240 sdep: payload: "C"
44218240-44218392 sdep: payload: "O"
44218392-44218544 sdep: payload: "N"
44218545-44218697 sdep: payload: "N"
44218697-44218849 sdep: payload: "
"
75169375-75169527 sdep: msg_type: "Command" "cmd"
75169527-75169832 sdep: cmd_id: "Command ID: 0x0a00" "cmd_id: 0a00"
75169832-75169985 sdep: payload_len: "Payload Length: 14, More: 0" "len: 14, more: 0"
75169985-75170137 sdep: payload: "A"
75170137-75170289 sdep: payload: "T"
75170289-75170442 sdep: payload: "+"
75170442-75170594 sdep: payload: "G"
75170594-75170746 sdep: payload: "A"
75170746-75170899 sdep: payload: "P"
75170899-75171051 sdep: payload: "G"
75171051-75171204 sdep: payload: "E"
75171204-75171356 sdep: payload: "T"
75171356-75171508 sdep: payload: "C"
75171508-75171661 sdep: payload: "O"
75171661-75171813 sdep: payload: "N"
75171813-75171965 sdep: payload: "N"
75171965-75172118 sdep: payload: "
"
106122644-106122796 sdep: msg_type: "Command" "cmd"
106122796-106123101 sdep: cmd_id: "Command ID: 0x0a00" "cmd_id: 0a00"
106123101-106123253 sdep: payload_len: "Payload Length: 14, More: 0" "len: 14, more: 0"
106123253-106123405 sdep: payload: "A"
106123406-106123558 sdep: payload: "T"
106123558-106123710 sdep: payload: "+"
106123710-106123863 sdep: payload: "G"
106123863-106124015 sdep: payload: "A"
106124015-106124167 sdep: payload: "P"
106124167-106124320 sdep: payload: "G"
106124320-106124472 sdep: payload: "E"
106124472-106124625 sdep: payload: "T"
106124625-106124777 sdep: payload: "C"
106124777-106124929 sdep: payload: "O"
106124929-106125082 sdep: payload: "N"
106125082-106125234 sdep: payload: "N"
106125234-106125386 sdep: payload: "
"
137075912-137076066 sdep: msg_type: "Command" "cmd"
137076065-137076369 sdep: cmd_id: "Command ID: 0x0a00" "cmd_id: 0a00"
137076369-137076522 sdep: payload_len: "Payload Length: 14, More: 0" "len: 14, more: 0"
137076522-137076674 sdep: payload: "A"
137076674-137076828 sdep: payload: "T"
137076827-137076979 sdep: payload: "+"
137076979-137077131 sdep: payload: "G"
137077131-137077284 sdep: payload: "A"
137077284-137077436 sdep: payload: "P"
137077436-137077588 sdep: payload: "G"
137077588-137077741 sdep: payload: "E"
137077741-137077893 sdep: payload: "T"
137077893-137078047 sdep: payload: "C"
137078046-137078198 sdep: payload: "O"
137078198-137078350 sdep: payload: "N"
137078350-137078503 sdep: payload: "N"
137078503-137078655 sdep: payload: "
"
168029181-168029333 sdep: msg_type: "Command" "cmd"
168029333-168029638 sdep: cmd_id: "Command ID: 0x0a00" "cmd_id: 0a00"
168029638-168029790 sdep: payload_len: "Payload Length: 14, More: 0" "len: 14, more: 0"
168029790-168029943 sdep: payload: "A"
168029943-168030095 sdep: payload: "T"
168030095-168030247 sdep: payload: "+"
168030247-168030400 sdep: payload: "G"
168030400-168030552 sdep: payload: "A"
168030552-168030705 sdep: payload: "P"
168030705-168030857 sdep: payload: "G"
168030857-168031009 sdep: payload: "E"
168031009-168031162 sdep: payload: "T"
168031162-168031314 sdep: payload: "C"
168031314-168031466 sdep: payload: "O"
168031466-168031619 sdep: payload: "N"
168031619-168031771 sdep: payload: "N"
168031771-168031924 sdep: payload: "
"
198982451-198982603 sdep: msg_type: "Command" "cmd"
198982603-198982908 sdep: cmd_id: "Command ID: 0x0a00" "cmd_id: 0a00"
198982908-198983060 sdep: payload_len: "Payload Length: 14, More: 0" "len: 14, more: 0"
198983060-198983212 sdep: payload: "A"
198983212-198983365 sdep: payload: "T"
198983365-198983517 sdep: payload: "+"
198983517-198983669 sdep: payload: "G"
198983670-198983822 sdep: payload: "A"
198983822-198983974 sdep: payload: "P"
198983974-198984127 sdep: payload: "G"
198984127-198984279 sdep: payload: "E"
198984279-198984431 sdep: payload: "T"
198984431-198984584 sdep: payload: "C"
198984584-198984736 sdep: payload: "O"
198984736-198984888 sdep: payload: "N"
198984889-198985041 sdep: payload: "N"
198985041-198985193 sdep: payload: "
"
229935720-229935872 sdep: msg_type: "Command" "cmd"
229935873-229936177 sdep: cmd_id: "Command ID: 0x0a00" "cmd_id: 0a00"
229936177-229936330 sdep: payload_len: "Payload Length: 14, More: 0" "len: 14, more: 0"
229936330-229936482 sdep: payload: "A"
229936482-229936634 sdep: payload: "T"
229936634-229936787 sdep: payload: "+"
229936787-229936939 sdep: payload: "G"
229936939-229937093 sdep: payload: "A"
229937092-229937244 sdep: payload: "P"
229937244-229937396 sdep: payload: "G"
229937396-229937549 sdep: payload: "E"
229937549-229937701 sdep: payload: "T"
229937701-229937853 sdep: payload: "C"
229937853-229938006 sdep: payload: "O"
229938006-229938158 sdep: payload: "N"
229938158-229938311 sdep: payload: "N"
229938311-229938463 sdep: payload: "
"
260888987-260889140 sdep: msg_type: "Command" "cmd"
260889140-260889445 sdep: cmd_id: "Command ID: 0x0a00" "cmd_id: 0a00"
260889445-260889597 sdep: payload_len: "Payload Length: 14, More: 0" "len: 14, more: 0"
260889597-260889749 sdep: payload: "A"
260889749-260889902 sdep: payload: "T"
260889902-260890054 sdep: payload: "+"
260890054-260890206 sdep: payload: "G"
260890207-260890359 sdep: payload: "A"
260890359-260890511 sdep: payload: "P"
260890511-260890664 sdep: payload: "G"
260890664-260890816 sdep: payload: "E"
260890816-260890968 sdep: payload: "T"
260890968-260891121 sdep: payload: "C"
260891121-260891273 sdep: payload: "O"
260891273-260891425 sdep: payload: "N"
260891426-260891578 sdep: payload: "N"
260891578-260891730 sdep: payload: "
"
291842255-291842407 sdep: msg_type: "Command" "cmd"
291842407-291842712 sdep: cmd_id: "Command ID: 0x0a00" "cmd_id: 0a00"
291842712-291842864 sdep: payload_len: "Payload Length: 14, More: 0" "len: 14, more: 0"
291842864-291843017 sdep: payload: "A"
291843017-291843169 sdep: payload: "T"
291843169-291843321 sdep: payload: "+"
291843322-291843474 sdep: payload: "G"
291843474-291843626 sdep: payload: "A"
291843626-291843779 sdep: payload: "P"
291843779-291843931 sdep: payload: "G"
291843931-291844083 sdep: payload: "E"
291844083-291844236 sdep: payload: "T"
291844236-291844388 sdep: payload: "C"
291844388-291844540 sdep: payload: "O"
291844541-291844693 sdep: payload: "N"
291844693-291844845 sdep: payload: "N"
291844845-291844998 sdep: payload: "
"
322795527-322795679 sdep: msg_type: "Command" "cmd"
322795679-322795984 sdep: cmd_id: "Command ID: 0x0a00" "cmd_id: 0a00"
322795984-322796136 sdep: payload_len: "Payload Length: 14, More: 0" "len: 14, more: 0"
322796136-322796289 sdep: payload: "A"
322796289-322796441 sdep: payload: "T"
322796441-322796593 sdep: payload: "+"
322796593-322796746 sdep: payload: "G"
322796746-322796898 sdep: payload: "A"
322796898-322797050 sdep: payload: "P"
322797051-322797203 sdep: payload: "G"
322797203-322797355 sdep: payload: "E"
322797355-322797509 sdep: payload: "T"
322797508-322797660 sdep: payload: "C"
322797660-322797812 sdep: payload: "O"
322797812-322797965 sdep: payload: "N"
322797965-322798117 sdep: payload: "N"
322798117-322798269 sdep: payload: "
"
